{
  "annotated_at": "2026-05-09T18:21:12.817721+00:00",
  "annotation_version": "1.0",
  "annotator": "automated_bootstrap",
  "applicable_dimensions": [
    "alt_text",
    "reading_order",
    "heading_semantics",
    "table_structure",
    "link_text",
    "decorative",
    "complex_content"
  ],
  "artifact_hashes": {
    "gold_remediation_sha256": "b37861e48b10f9b1ed0a408a6cb23e9cb81db767c3646f1f342102e3a662d5d3",
    "known_bad_sha256": {
      "tools/corpus_annotations/v1/artifacts/pdf/pdf_020_bad.pdf": "9eee44d1fbfea70ce742e4b793232e7c4bb460921aea5c6e27b59b4ecd034ad3"
    },
    "source_sha256": "52be1207439dac613d223a538ed5791b0354bd8be9b52a373b96ed788af20240"
  },
  "dimensions": {
    "alt_text": {
      "notes": "",
      "score": 0.9
    },
    "complex_content": {
      "notes": "",
      "score": 0.9
    },
    "decorative": {
      "notes": "",
      "score": 0.9
    },
    "heading_semantics": {
      "notes": "",
      "score": 0.9
    },
    "link_text": {
      "notes": "",
      "score": 0.9
    },
    "reading_order": {
      "notes": "",
      "score": 0.9
    },
    "table_structure": {
      "notes": "",
      "score": 0.9
    }
  },
  "doc_id": "pdf_020",
  "document_class": "form",
  "edge_case_flags": [],
  "format": "pdf",
  "format_specific": {
    "pdf": {
      "page_count": 1
    }
  },
  "gold_remediation_path": "tools/corpus_annotations/v1/artifacts/pdf/pdf_020_gold.pdf",
  "known_bad_artifact_paths": [
    "tools/corpus_annotations/v1/artifacts/pdf/pdf_020_bad.pdf"
  ],
  "pairwise_comparisons": [],
  "provenance": {
    "candidate_seed_model": "",
    "candidate_seed_notes": "",
    "gold_standard_source": "human_specialist",
    "human_verified": true
  },
  "source_path": "tools/corpus_annotations/v1/artifacts/pdf/pdf_020_source.pdf"
}
