{
  "annotated_at": "2026-05-09T18:21:12.836457+00:00",
  "annotation_version": "1.0",
  "annotator": "automated_bootstrap",
  "applicable_dimensions": [
    "alt_text",
    "reading_order",
    "heading_semantics",
    "table_structure",
    "link_text",
    "decorative",
    "complex_content"
  ],
  "artifact_hashes": {
    "gold_remediation_sha256": "3f0f6c4983ae2c3895e80a83d980a36c788c2515da7c7eb886808b5f3e4d6bdd",
    "known_bad_sha256": {
      "tools/corpus_annotations/v1/artifacts/docx/docx_001_bad.docx": "1e418c0f1ef737f34fa0517d2bd04ffc72fb7f3c5ba2842707902f9569d9a190"
    },
    "source_sha256": "c7b83079444233ff2fe48036568872fc0aab54b4f182019997ee1ef9e0ee6391"
  },
  "dimensions": {
    "alt_text": {
      "notes": "",
      "score": 0.9
    },
    "complex_content": {
      "notes": "",
      "score": 0.9
    },
    "decorative": {
      "notes": "",
      "score": 0.9
    },
    "heading_semantics": {
      "notes": "",
      "score": 0.9
    },
    "link_text": {
      "notes": "",
      "score": 0.9
    },
    "reading_order": {
      "notes": "",
      "score": 0.9
    },
    "table_structure": {
      "notes": "",
      "score": 0.9
    }
  },
  "doc_id": "docx_001",
  "document_class": "report",
  "edge_case_flags": [],
  "format": "docx",
  "format_specific": {
    "docx": {}
  },
  "gold_remediation_path": "tools/corpus_annotations/v1/artifacts/docx/docx_001_gold.docx",
  "known_bad_artifact_paths": [
    "tools/corpus_annotations/v1/artifacts/docx/docx_001_bad.docx"
  ],
  "pairwise_comparisons": [],
  "provenance": {
    "candidate_seed_model": "",
    "candidate_seed_notes": "",
    "gold_standard_source": "human_specialist",
    "human_verified": true
  },
  "source_path": "tools/corpus_annotations/v1/artifacts/docx/docx_001_source.docx"
}
